{"eventId":"0198fa2f-bd53-7ad2-86b7-9d6efd644a40","eventType":"identity.user-registered.v1","aggregateType":"UserAccount","aggregateId":"0198fa2f-bd53-7ad2-86b7-9d6efd644a41","aggregateVersion":1,"occurredAt":"2026-08-04T12:00:00Z","correlationId":"m1-registration-example","causationId":null,"producer":"identity-service","schemaVersion":1,"data":{"userId":"0198fa2f-bd53-7ad2-86b7-9d6efd644a41","verificationId":"0198fa2f-bd53-7ad2-86b7-9d6efd644a42"}}
