{"eventId":"0198fa2f-bd53-7ad2-86b7-9d6efd644a44","eventType":"seller.seller-approved.v1","aggregateType":"Seller","aggregateId":"0198fa2f-bd53-7ad2-86b7-9d6efd644a45","aggregateVersion":2,"occurredAt":"2026-08-04T12:20:00Z","correlationId":"m1-approve-example","causationId":null,"producer":"seller-service","schemaVersion":1,"data":{"sellerId":"0198fa2f-bd53-7ad2-86b7-9d6efd644a45","ownerUserId":"0198fa2f-bd53-7ad2-86b7-9d6efd644a41"}}
