{"eventId":"0198fa2f-bd53-7ad2-86b7-9d6efd644a43","eventType":"identity.user-disabled.v1","aggregateType":"UserAccount","aggregateId":"0198fa2f-bd53-7ad2-86b7-9d6efd644a41","aggregateVersion":2,"occurredAt":"2026-08-04T12:10:00Z","correlationId":"m1-disable-example","causationId":null,"producer":"identity-service","schemaVersion":1,"data":{"userId":"0198fa2f-bd53-7ad2-86b7-9d6efd644a41","reasonCode":"SECURITY_REVIEW"}}
