{"eventId":"0198fa2f-bd53-7ad2-86b7-9d6efd644a48","eventType":"seller.seller-suspended.v1","aggregateType":"Seller","aggregateId":"0198fa2f-bd53-7ad2-86b7-9d6efd644a45","aggregateVersion":3,"occurredAt":"2026-08-04T12:40:00Z","correlationId":"m1-suspend-example","causationId":null,"producer":"seller-service","schemaVersion":1,"data":{"sellerId":"0198fa2f-bd53-7ad2-86b7-9d6efd644a45","reasonCode":"POLICY_VIOLATION"}}
